{
	"$schema": "../../../packages/contracts/schemas/blueprint.schema.json",
	"schemaVersion": 1,
	"architecture": "0.2.0",
	"owner": "platform-architecture",
	"status": "approved",
	"id": "security-review",
	"version": "1.0.0",
	"risk": "read",
	"agentRoles": ["reviewer"],
	"executorProfiles": ["reviewer"],
	"requiredReviewers": ["platform-owner"],
	"requiresApprovedSpec": false
}
