{
	"$schema": "../../../packages/contracts/schemas/blueprint.schema.json",
	"schemaVersion": 1,
	"architecture": "0.2.0",
	"owner": "platform-architecture",
	"status": "approved",
	"id": "release",
	"version": "1.0.0",
	"risk": "process",
	"agentRoles": ["module-executor"],
	"executorProfiles": ["repo-agent"],
	"requiredReviewers": ["reviewer", "platform-owner"],
	"requiresApprovedSpec": false
}
