{
	"$schema": "../../../packages/contracts/schemas/blueprint.schema.json",
	"schemaVersion": 1,
	"architecture": "0.2.0",
	"owner": "platform-architecture",
	"status": "draft",
	"id": "agentic-module",
	"version": "1.0.0",
	"risk": "workspace-write",
	"agentRoles": [
		"business-manager",
		"backend-engineer",
		"agentic-engineer",
		"frontend-engineer"
	],
	"executorProfiles": ["sandbox-specialist", "repo-agent"],
	"requiredReviewers": ["reviewer"],
	"requiresApprovedSpec": true
}
